{"schemaVersion":"cartofreako-projection-fixtures-v1","family":"dymaxion","coordinateContract":{"geographic":"[longitude, latitude] degrees","projected":"[u, v] normalized page coordinates","origin":"top-left","xAxis":"right","yAxis":"down"},"layouts":[{"layoutId":"dymaxion/fuller-horizontal","nativeAspect":2.1169509870286283,"componentModel":"23 registered faces/subfaces; component 0","cutTopology":"icosahedral interruptions plus Australia and Japan subdivisions","cases":[{"caseId":"face-center-00","operation":"forward-reverse","input":{"geographic":[23.032227440866443,28.173218757257807]},"expected":{"projected":[0.36363636363636365,0.2222222222222222],"topologyKey":"fuller-registered-face:00","component":0,"reverseStatus":"unique","reverseCandidates":[{"geographic":[23.032227440866436,28.173218757257807],"topologyKey":"fuller-registered-face:00","component":0,"boundary":false}]},"boundaryClass":"interior","tolerances":{"angularDegrees":2e-8,"normalizedPlanar":1e-9},"evidence":{"grade":"structural-invariant","source":"declared spherical topology and registered layout","revision":1}},{"caseId":"face-center-01","operation":"forward-reverse","input":{"geographic":[71.52790329909925,46.04189431883772]},"expected":{"projected":[0.3636363636363637,0.4444444444444444],"topologyKey":"fuller-registered-face:01","component":0,"reverseStatus":"unique","reverseCandidates":[{"geographic":[71.52790329909925,46.041894318837734],"topologyKey":"fuller-registered-face:01","component":0,"boundary":false}]},"boundaryClass":"interior","tolerances":{"angularDegrees":2e-8,"normalizedPlanar":1e-9},"evidence":{"grade":"structural-invariant","source":"declared spherical topology and registered layout","revision":1}},{"caseId":"face-center-02","operation":"forward-reverse","input":{"geographic":[145.35624192277984,74.92843438917429]},"expected":{"projected":[0.45454545454545453,0.5555555555555556],"topologyKey":"fuller-registered-face:02","component":0,"reverseStatus":"unique","reverseCandidates":[{"geographic":[145.35624192277973,74.92843438917434],"topologyKey":"fuller-registered-face:02","component":0,"boundary":false}]},"boundaryClass":"interior","tolerances":{"angularDegrees":2e-8,"normalizedPlanar":1e-9},"evidence":{"grade":"structural-invariant","source":"declared spherical topology and registered layout","revision":1}},{"caseId":"face-center-03","operation":"forward-reverse","input":{"geographic":[-77.20705748560815,60.43279526305555]},"expected":{"projected":[0.5454545454545455,0.4444444444444444],"topologyKey":"fuller-registered-face:03","component":0,"reverseStatus":"unique","reverseCandidates":[{"geographic":[-77.20705748560817,60.432795263055525],"topologyKey":"fuller-registered-face:03","component":0,"boundary":false}]},"boundaryClass":"interior","tolerances":{"angularDegrees":2e-8,"normalizedPlanar":1e-9},"evidence":{"grade":"structural-invariant","source":"declared spherical topology and registered layout","revision":1}},{"caseId":"face-center-04","operation":"forward-reverse","input":{"geographic":[-25.817702244712038,34.388445323561044]},"expected":{"projected":[0.45454545454545453,0.11111111111111127],"topologyKey":"fuller-registered-face:04","component":0,"reverseStatus":"unique","reverseCandidates":[{"geographic":[-25.817702244712,34.38844532356106],"topologyKey":"fuller-registered-face:04","component":0,"boundary":false}]},"boundaryClass":"interior","tolerances":{"angularDegrees":2e-8,"normalizedPlanar":1e-9},"evidence":{"grade":"structural-invariant","source":"declared spherical topology and registered layout","revision":1}},{"caseId":"face-center-05","operation":"forward-reverse","input":{"geographic":[29.020059496143407,-13.233127456694573]},"expected":{"projected":[0.27272727272727276,0.11111111111111106],"topologyKey":"fuller-registered-face:05","component":0,"reverseStatus":"unique","reverseCandidates":[{"geographic":[29.02005949614338,-13.233127456694563],"topologyKey":"fuller-registered-face:05","component":0,"boundary":false}]},"boundaryClass":"interior","tolerances":{"angularDegrees":2e-8,"normalizedPlanar":1e-9},"evidence":{"grade":"structural-invariant","source":"declared spherical topology and registered layout","revision":1}},{"caseId":"face-center-06","operation":"forward-reverse","input":{"geographic":[71.77536569802348,-24.486526988568926]},"expected":{"projected":[0.18181818181818185,0.4444444444444444],"topologyKey":"fuller-registered-face:06","component":0,"reverseStatus":"unique","reverseCandidates":[{"geographic":[71.77536569802349,-24.48652698856892],"topologyKey":"fuller-registered-face:06","component":0,"boundary":false}]},"boundaryClass":"interior","tolerances":{"angularDegrees":2e-8,"normalizedPlanar":1e-9},"evidence":{"grade":"structural-invariant","source":"declared spherical topology and registered layout","revision":1}},{"caseId":"face-center-07","operation":"forward-reverse","input":{"geographic":[96.15073392959359,9.897578191520502]},"expected":{"projected":[0.27272727272727265,0.5555555555555555],"topologyKey":"fuller-registered-face:07","component":0,"reverseStatus":"unique","reverseCandidates":[{"geographic":[96.15073392959359,9.897578191520477],"topologyKey":"fuller-registered-face:07","component":0,"boundary":false}]},"boundaryClass":"interior","tolerances":{"angularDegrees":2e-8,"normalizedPlanar":1e-9},"evidence":{"grade":"structural-invariant","source":"declared spherical topology and registered layout","revision":1}},{"caseId":"face-center-08","operation":"forward-reverse","input":{"geographic":[169.2473398034819,34.717192809263665]},"expected":{"projected":[0.45454545454545453,0.7777777777777778],"topologyKey":"fuller-registered-face:08","component":0,"reverseStatus":"unique","reverseCandidates":[{"geographic":[169.24733980348188,34.717192809263665],"topologyKey":"fuller-registered-face:08","component":0,"boundary":false}]},"boundaryClass":"interior","tolerances":{"angularDegrees":2e-8,"normalizedPlanar":1e-9},"evidence":{"grade":"structural-invariant","source":"declared spherical topology and registered layout","revision":1}},{"caseId":"face-center-09","operation":"forward-reverse","input":{"geographic":[-150.9799405038566,13.233127456694573]},"expected":{"projected":[0.6363636363636364,0.7777777777777778],"topologyKey":"fuller-registered-face:09","component":0,"reverseStatus":"unique","reverseCandidates":[{"geographic":[-150.97994050385662,13.23312745669458],"topologyKey":"fuller-registered-face:09","component":0,"boundary":false}]},"boundaryClass":"interior","tolerances":{"angularDegrees":2e-8,"normalizedPlanar":1e-9},"evidence":{"grade":"structural-invariant","source":"declared spherical topology and registered layout","revision":1}},{"caseId":"face-center-10","operation":"forward-reverse","input":{"geographic":[-108.22463430197652,24.48652698856893]},"expected":{"projected":[0.6363636363636362,0.5555555555555556],"topologyKey":"fuller-registered-face:10","component":0,"reverseStatus":"unique","reverseCandidates":[{"geographic":[-108.22463430197655,24.486526988568986],"topologyKey":"fuller-registered-face:10","component":0,"boundary":false}]},"boundaryClass":"interior","tolerances":{"angularDegrees":2e-8,"normalizedPlanar":1e-9},"evidence":{"grade":"structural-invariant","source":"declared spherical topology and registered layout","revision":1}},{"caseId":"face-center-11","operation":"forward-reverse","input":{"geographic":[-83.84926607040643,-9.897578191520502]},"expected":{"projected":[0.7272727272727273,0.4444444444444444],"topologyKey":"fuller-registered-face:11","component":0,"reverseStatus":"unique","reverseCandidates":[{"geographic":[-83.84926607040644,-9.897578191520497],"topologyKey":"fuller-registered-face:11","component":0,"boundary":false}]},"boundaryClass":"interior","tolerances":{"angularDegrees":2e-8,"normalizedPlanar":1e-9},"evidence":{"grade":"structural-invariant","source":"declared spherical topology and registered layout","revision":1}},{"caseId":"face-center-12","operation":"forward-reverse","input":{"geographic":[-42.02241568705746,-4.530154895350926]},"expected":{"projected":[0.7272727272727273,0.2222222222222222],"topologyKey":"fuller-registered-face:12","component":0,"reverseStatus":"unique","reverseCandidates":[{"geographic":[-42.02241568705746,-4.530154895350915],"topologyKey":"fuller-registered-face:12","component":0,"boundary":false}]},"boundaryClass":"interior","tolerances":{"angularDegrees":2e-8,"normalizedPlanar":1e-9},"evidence":{"grade":"structural-invariant","source":"declared spherical topology and registered layout","revision":1}},{"caseId":"face-center-13","operation":"forward-reverse","input":{"geographic":[-10.752660196518114,-34.71719280926367]},"expected":{"projected":[0.9090909090909091,0.2222222222222222],"topologyKey":"fuller-registered-face:13","component":0,"reverseStatus":"unique","reverseCandidates":[{"geographic":[-10.752660196518143,-34.71719280926367],"topologyKey":"fuller-registered-face:13","component":0,"boundary":false}]},"boundaryClass":"interior","tolerances":{"angularDegrees":2e-8,"normalizedPlanar":1e-9},"evidence":{"grade":"structural-invariant","source":"declared spherical topology and registered layout","revision":1}},{"caseId":"face-center-14","operation":"forward-reverse","input":{"geographic":[154.18229775528798,-34.388445323561044]},"expected":{"projected":[0.18181818181818182,0.888888888888889],"topologyKey":"fuller-registered-face:14","component":0,"reverseStatus":"unique","reverseCandidates":[{"geographic":[154.18229775528798,-34.38844532356105],"topologyKey":"fuller-registered-face:14","component":0,"boundary":false}]},"boundaryClass":"interior","tolerances":{"angularDegrees":2e-8,"normalizedPlanar":1e-9},"evidence":{"grade":"structural-invariant","source":"declared spherical topology and registered layout","revision":1}},{"caseId":"face-center-15","operation":"forward-reverse","input":{"geographic":[-156.96777255913358,-28.173218757257807]},"expected":{"projected":[0.7272727272727273,0.888888888